{
  "schema_version": "answer-document-version-v1",
  "organization_id": "org_alpha",
  "workspace_id": "ws_alpha",
  "answer_document_id": "ansdoc_alpha",
  "version": 2,
  "previous_version_hash": "sha256:2222222222222222222222222222222222222222222222222222222222222222",
  "amendment_class": "SUPERSEDE",
  "amendment_reason": "\u041e\u043f\u0440\u043e\u0432\u0435\u0440\u0433\u043d\u0443\u0442\u0430 \u0446\u0438\u0444\u0440\u0430 \u043a\u0432\u0430\u0440\u0442\u0430\u043b\u044c\u043d\u043e\u0439 \u0432\u044b\u0440\u0443\u0447\u043a\u0438, \u0443\u0442\u043e\u0447\u043d\u0435\u043d\u0430 \u043f\u043e \u0433\u043e\u0434\u043e\u0432\u043e\u043c\u0443 \u043e\u0442\u0447\u0451\u0442\u0443.",
  "amended_at": "2026-08-14T11:00:00Z",
  "manifest_hash": "sha256:3333333333333333333333333333333333333333333333333333333333333333",
  "actor_principal_id": "usr_alice",
  "request_id": "req_answer_002",
  "signature": {
    "algorithm": "ED25519",
    "key_id": "key_answer_signing_alpha",
    "signed_at": "2026-08-14T11:00:00Z",
    "value_base64": "AAAAAAAAAAAAAAAAAAAAAAAAAAAAAAAAAAAAAAAAAAAAAAAAAAAAAAAAAAAAAAAAAAAAAAAAAAAAAAAAAAAAAA=="
  }
}
